chunk_idx,anchor,Q,A,E
1,edge,"How do directed edges differ from undirected edges, and why does this distinction matter in graph theory?","Directed edges specify a direction between two vertices (one as head and one as tail), whereas undirected edges do not imply any direction. This difference matters because it allows for the representation of asymmetric relationships, which is crucial in scenarios like modeling one-way streets or information flow in networks.","A directed edge is speciﬁed as an ordered pair of vertices u, v and is denoted by .u; v/ or u ! v."
4,graph,"How does strong connectivity differ from weak connectivity in directed graphs, and why is this distinction important?","Strong connectivity in a directed graph requires that there be a path from every node to every other node, whereas weak connectivity only demands that the underlying undirected graph be connected. This difference matters because it affects how we analyze the reachability within the graph; for instance, in network design, strong connectivity ensures full bidirectional communication between all nodes.","A directed graph is said to be weakly connected (or, more simply, connected) if the corresponding undirected graph (where directed edges u ! v and/or v ! u are replaced with a single undirected edge fu; vg is connected."
6,tournament,Explain how the existence of a Hamiltonian path in a tournament graph can be proven and why this is significant for understanding directed graphs.,"Proving the existence of a Hamiltonian path in a tournament graph involves showing that every vertex can be connected in a specific sequence, such as \(a > b > d > e > c\), where each node points to the next. This significance lies in confirming that there’s always an ordered sequence of wins and losses among all participants, which is crucial for understanding connectivity and order in directed graphs. For instance, in Figure 6.5, vertices are partitioned into sets \(T\) and \(F\), where edges within each set form smaller tournaments with their own Hamiltonian paths, ultimately proving the larger tournament’s path existence through strong induction. This method ensures that every player can be ranked based on their performance.",The vertices in T together with the edges that join them form a smaller tournament.
7,chicken,"Explain how the concept of a ""king chicken"" in a farmyard relates to strong connectivity in directed graphs and why it matters for understanding dominance hierarchies.","A ""king chicken"" is a chicken that virtually pecks every other chicken, analogous to a strongly connected component in a directed graph where every vertex can reach every other vertex through directed paths. This concept matters because it helps identify the most dominant individuals in a group, ensuring they have influence over all others, similar to how strong connectivity ensures full reachability within a network. For instance, in Figure 6.6, chickens a, b, and d are king chickens, illustrating that these chickens dominate the entire farmyard. Recognizing such structures is crucial for understanding social dynamics and predicting outcomes in dominance hierarchies.",A chicken that virtually pecks every other chicken is called a king chicken.
10,packet,Explain how packets are used in data transmission and compare this with the scenario where multiple packets might be involved.,"Packets are used in data transmission by carrying fixed amounts of data, allowing messages like web pages or movies to consist of many such packets. In scenarios involving just one packet per input and output, routing problems require defining paths from each input to its specified output; however, when multiple packets are present, the system must manage concurrent transmissions, potentially increasing the complexity and time needed for delivery due to shared wires and switches.","For simplicity, we will restrict our attention to the scenario where there is just one packet at every input and where there is just one packet destined for each output."
12,output,Explain how latency affects packet travel in networks and why the unique path from input to output matters for network design.,"Latency, which refers to the delay between a packet arriving at an input and reaching its designated output, is critical in communication networks as it can significantly impact performance. The unique path from input 1 to output 3 being shown in bold highlights that this specific route might be optimized or highlighted for analysis purposes; for instance, in Figure 6.8, the distance between input 1 and output 3 is six, indicating a longer path which could affect overall network efficiency. This matters because understanding these paths helps in designing networks where packets can travel with minimal delay, ensuring better performance and reliability. For example, recognizing such paths enables engineers to identify potential bottlenecks or optimize routing algorithms.",The unique path from input 1 to output 3 is shown in bold.
13,diameter,"How does increasing the size of switches in a network affect its diameter, and why is this important for latency?","Increasing the size of switches can reduce the network's diameter by allowing more direct connections between nodes, thereby decreasing the maximum distance any packet must travel. For instance, using 4 × 4 switches instead of 3 × 3 ones in a complete binary tree could lead to a smaller diameter and lower latency. This is crucial for reducing delay times, which directly impacts performance in real-time applications or large-scale data centers.","If we had 4 × 4 switches, then we could construct a complete ternary tree with an even smaller diameter."
14,path,"How does path congestion affect the performance and reliability of a communication network designed with directed graphs, and why is this consideration critical? In such networks, the root switch can become a bottleneck, handling an enormous amount of traffic when packets travel from one side to the other, which could significantly degrade performance. Moreover, if this switch fails, it can break the network into two pieces, highlighting the importance of managing path congestion to ensure reliable operation.","Path congestion in directed graphs can severely impact both the performance and reliability of a communication network by causing bottlenecks at critical switches. For instance, when packets follow paths that frequently pass through the same switch, this switch becomes overloaded, potentially slowing down traffic. Additionally, if this switch fails, it can partition the network, leading to service disruption. Thus, carefully designing paths to minimize congestion is crucial for maintaining a robust and efficient network.","The congestion of a routing, P , is equal to the largest number of paths in P that pass through a single switch."
16,complete binary tree,"How does the congestion in a complete binary tree compare to other network designs, and why is this significant for practical applications?","The complete binary tree has a maximum congestion of \(N\), which is significantly higher than other network designs. This high congestion makes it less suitable for practical applications where minimizing data bottlenecks is crucial. In contrast, networks like the 2-d array have lower diameters but introduce more complexity.",The max congestion of the complete binary tree is N —which is horrible!
17,switch,"How does the switch size and number of switches in a 2-D array compare to those in a complete binary tree, and why do these differences matter?","The 2-D array uses 2×2 switches, whereas a complete binary tree employs single-input/single-output (SISO) switches. Notably, the 2-D array requires N^2 switches compared to just O(N log N) in the complete binary tree, making the former impractical for large N due to the sheer number of switches needed; this is a critical factor when considering scalability and implementation costs.",a network with N D 1000 inputs would require a million 22 switches!
18,switch,Explain how the switches in a butterfly network function and why their arrangement is significant for data routing.,"In a butterfly network, each switch connects to two switches at the next level based on specific binary labels, facilitating complex data routing paths. This unique connection pattern allows efficient data flow between input and output terminals by leveraging multiple switching levels, making it suitable for high-performance communication networks. The arrangement ensures that data can take various routes through the network, enhancing flexibility and reliability.","Between the inputs and outputs, there are log.N / C 1 levels of switches, numbered from 0 to log N."
21,network,"How does the Beneš network differ from other networks in terms of size and diameter, and why are these differences significant for communication networks?","The Beneš network has smaller size and diameter compared to complete binary trees, 2-D arrays, and butterfly networks, which makes it more efficient. This reduction in size and diameter allows the Beneš network to completely eliminate congestion, a key advantage for optimal routing in large-scale communication systems.","The Beneˇs network has small size and diameter, and completely eliminates congestion."
22,works,Explain how guiding packets safely through just the first and last levels of a Beneš network works and why this approach is crucial for proving congestion.,"Guiding packets safely through just the first and last levels involves ensuring that only the initial and final stages handle packet routing, while relying on induction for intermediate stages. This method is crucial because it allows leveraging the inductive assumption that subnetworks can route arbitrary permutations with congestion 1, thereby simplifying the proof of overall network performance.","By the inductive assumption, the subnetworks can each route an arbitrary permutation with congestion 1."
23,edge,Explain how the constraint graph's properties influence the routing problem and why the distinction between single and double edges matters.,"The constraint graph’s property that at most one edge is incident to each vertex influences the routing problem by ensuring that packets destined for different outputs cannot share the same switch, thus preventing packet collisions. This is crucial because a 2-coloring of the graph corresponds to a solution where red packets use one network and blue packets use another, satisfying all constraints. The distinction between single and double edges matters as doubled edges imply no other edge can be incident to their endpoints from the same set, simplifying the verification of whether the graph is 2-colorable.","Note that no other edge can be incident to either of the endpoints of a doubled edge, since that endpoint would then be incident to two edges from the same set."
24,edges,"Explain how edges contribute to the coloring and routing problems, particularly focusing on their role in forming cycles and connected components.","Edges determine whether a graph is 2-colorable by influencing the presence or absence of odd cycles; specifically, graphs without odd cycles can be 2-colored. Additionally, edges form connected components that can be colored with fewer colors when isolated, allowing for more efficient overall coloring strategies. This insight helps in solving packet routing problems within smaller networks by ensuring even cycle lengths through alternating edge traversals.","Such connected components are easily colored with 2 colors and so we can henceforth ignore them and focus on the remaining nodes and edges, which form a simple graph."
25, subnetwork,Explain how routing packets through separate subnetworks ensures conflict-free communication and why this approach matters.,"Routing packets of one color through the upper subnetwork and packets of another color through the lower subnetwork prevents conflicts at each level since vertices for edges in E1 are split between the two subnetworks, and those from E2 have their endpoints in different subnetworks. This method guarantees efficient communication without interference, which is crucial for maintaining network performance in scenarios involving high data traffic.",Now route packets of one color through the upper subnetwork and packets of the other color through the lower subnetwork.
